{
  "schema_version": "1.0",
  "name": "SavoirAssocie",
  "table": "savoir_associe",
  "fields": [
    {
      "name": "libelle",
      "type": "text",
      "required": true,
      "nullable": false,
      "unique": false
    },
    {
      "name": "sequence_id",
      "type": "foreign_key",
      "references": "Sequence",
      "required": true
    }
  ],
  "options": {
    "timestamps": true,
    "soft_delete": false
  }
}
