{
  "schema_version": "1.0",
  "name": "VersionStarter",
  "table": "version_starter",
  "fields": [
    {
      "name": "version",
      "type": "string",
      "max_length": 20,
      "required": true,
      "nullable": false,
      "unique": false
    },
    {
      "name": "statut",
      "type": "string",
      "max_length": 20,
      "required": true,
      "nullable": false,
      "unique": false
    },
    {
      "name": "activite_glissante",
      "type": "boolean",
      "required": true,
      "nullable": false,
      "unique": false
    },
    {
      "name": "ordre_impose",
      "type": "boolean",
      "required": true,
      "nullable": false,
      "unique": false
    },
    {
      "name": "starter_id",
      "type": "foreign_key",
      "references": "StarterWelcome",
      "required": true
    }
  ],
  "options": {
    "timestamps": true,
    "soft_delete": false
  }
}
