{
  "schema_version": "1.0",
  "name": "Certification",
  "table": "certification",
  "fields": [
    {
      "name": "code",
      "type": "string",
      "max_length": 50,
      "required": true,
      "nullable": false,
      "unique": true
    },
    {
      "name": "libelle",
      "type": "string",
      "max_length": 200,
      "required": true,
      "nullable": false,
      "unique": false
    },
    {
      "name": "type",
      "type": "string",
      "max_length": 40,
      "required": true,
      "nullable": false,
      "unique": false
    },
    {
      "name": "niveau_rncp",
      "type": "string",
      "max_length": 10,
      "required": false,
      "nullable": true,
      "unique": false
    },
    {
      "name": "autorite_certificatrice",
      "type": "string",
      "max_length": 200,
      "required": false,
      "nullable": true,
      "unique": false
    },
    {
      "name": "statut",
      "type": "string",
      "max_length": 20,
      "required": true,
      "nullable": false,
      "unique": false
    }
  ],
  "options": {
    "timestamps": true,
    "soft_delete": false
  }
}
