{
  "schema_version": "1.0",
  "name": "RessourceDossier",
  "table": "ressource_dossier",
  "fields": [
    {
      "name": "type",
      "type": "string",
      "max_length": 20,
      "required": true,
      "nullable": false,
      "unique": false
    },
    {
      "name": "titre",
      "type": "string",
      "max_length": 200,
      "required": true,
      "nullable": false,
      "unique": false
    },
    {
      "name": "ordre",
      "type": "integer",
      "required": true,
      "nullable": false,
      "unique": false
    },
    {
      "name": "contenu",
      "type": "text",
      "required": false,
      "nullable": true,
      "unique": false
    },
    {
      "name": "media_ref",
      "type": "string",
      "max_length": 255,
      "required": false,
      "nullable": true,
      "unique": false
    },
    {
      "name": "url",
      "type": "string",
      "max_length": 500,
      "required": false,
      "nullable": true,
      "unique": false
    },
    {
      "name": "dossier_technique_id",
      "type": "foreign_key",
      "references": "DossierTechnique",
      "required": true
    }
  ],
  "options": {
    "timestamps": true,
    "soft_delete": false
  }
}
