{
  "schema_version": "1.0",
  "name": "ResultatAttendu",
  "table": "resultat_attendu",
  "fields": [
    {
      "name": "code",
      "type": "string",
      "max_length": 100,
      "required": true,
      "nullable": false,
      "unique": false
    },
    {
      "name": "libelle",
      "type": "text",
      "required": true,
      "nullable": false,
      "unique": false
    },
    {
      "name": "activite_id",
      "type": "foreign_key",
      "references": "ActiviteProfessionnelle",
      "required": true
    }
  ],
  "options": {
    "timestamps": true,
    "soft_delete": false
  }
}
