{
  "schema_version": "1.0",
  "name": "Parcours",
  "table": "parcours",
  "fields": [
    {
      "name": "titre",
      "type": "string",
      "max_length": 200,
      "required": true,
      "nullable": false,
      "unique": false
    },
    {
      "name": "version_starter_id",
      "type": "foreign_key",
      "references": "VersionStarter",
      "required": true
    }
  ],
  "options": {
    "timestamps": true,
    "soft_delete": false
  }
}
