{
  "schema_version": "1.0",
  "name": "Connaissance",
  "table": "connaissance",
  "fields": [
    {
      "name": "libelle",
      "type": "text",
      "required": true,
      "nullable": false,
      "unique": false
    },
    {
      "name": "niveau_taxonomique",
      "type": "integer",
      "required": false,
      "nullable": true,
      "unique": false
    },
    {
      "name": "competence_id",
      "type": "foreign_key",
      "references": "Competence",
      "required": true
    }
  ],
  "options": {
    "timestamps": true,
    "soft_delete": false
  }
}
