{
  "schema_version": "1.0",
  "name": "Professeur",
  "table": "professeur",
  "fields": [
    {
      "name": "nom",
      "type": "string",
      "max_length": 100,
      "required": true,
      "nullable": false,
      "unique": false
    },
    {
      "name": "prenom",
      "type": "string",
      "max_length": 100,
      "required": true,
      "nullable": false,
      "unique": false
    },
    {
      "name": "user_id",
      "type": "big_integer",
      "required": false,
      "nullable": true,
      "unique": false
    }
  ],
  "options": {
    "timestamps": true,
    "soft_delete": false
  }
}
